{
  "document_type": "equity_report",
  "locale": "zh-CN",
  "meta": {
    "title": "腾讯控股 (0700.HK)",
    "subtitle": "游戏业务复苏叠加广告增长提速，云业务亏损收窄路径清晰，维持买入评级",
    "eyebrow": "Momo Paper / equity_report / zh-CN",
    "date": "2025-04-27",
    "analyst": "Momo Research",
    "disclaimer": "本报告仅供参考，不构成投资建议。所述观点基于公开信息分析，可能因市场变化而调整。投资者应独立判断并承担风险。"
  },
  "sections": {
    "thesis": {
      "rating": "买入",
      "target_price": "目标价 HK$450",
      "summary_points": [
        "游戏业务：本土市场收入恢复正增长，海外收入占比提升至 30%",
        "广告业务：视频号广告收入同比增长 60%+，带动整体广告增速回升至 20%",
        "云与企业服务：经营亏损同比收窄 40%，预计 FY26 实现盈亏平衡"
      ]
    },
    "business_snapshot": {
      "body": [
        "腾讯控股是中国领先的互联网科技公司，业务涵盖社交与通信（微信/QQ）、数字内容（游戏/视频/音乐）、金融科技（微信支付/理财通）以及企业服务（腾讯云）。截至 2024 年末，微信及 WeChat 合并月活达 13.8 亿，是全球最大的移动社交平台之一。",
        "公司收入来源高度多元化：增值服务（游戏+会员）占比约 45%，网络广告占比约 20%，金融科技及企业服务占比约 35%。这种结构使公司在单一业务承压时具备较强的抗风险能力。"
      ],
      "cards": [
        { "label": "市值", "value": "3.82", "unit": "万亿港元" },
        { "label": "PE (TTM)", "value": "18.2", "unit": "x" },
        { "label": "Forward PE", "value": "15.8", "unit": "x" },
        { "label": "ROE", "value": "22.4", "unit": "%" },
        { "label": "净现金", "value": "1,200", "unit": "亿港元" },
        { "label": "股息率", "value": "1.8", "unit": "%" }
      ]
    },
    "price_and_drivers": {
      "body": [
        "过去 12 个月，腾讯股价从 HK$320 回升至 HK$395，累计涨幅约 23%，但仍低于 2021 年初高点 HK$760 的 48%。当前估值处于近五年中枢下方，反映市场对监管环境和增长放缓的过度担忧。",
        "股价驱动的核心因素正在转变：从「监管压制」转向「基本面修复」。游戏版号常态化、视频号商业化加速、AI 赋能广告效率提升，均构成中期增长催化剂。"
      ],
      "drivers": [
        "游戏版号审批常态化，2024 年获批版号数量同比增长 25%",
        "视频号 DAU 突破 5 亿，用户使用时长同比增长 30%",
        "混元大模型接入广告系统，广告点击率提升 15-20%",
        "腾讯云订单增速回升至双位数，利润率改善"
      ]
    },
    "valuation": {
      "body": [
        "我们采用分部估值法（SOTP）对腾讯进行估值。核心假设包括：游戏业务给予 18x PE（行业龙头溢价）、广告业务给予 15x EV/EBITDA、金融科技给予 12x PE、投资业务按市值折价 20%。"
      ],
      "table": {
        "headers": ["业务板块", "估值方法", "估值倍数", "隐含价值", "占比"],
        "rows": [
          ["游戏", "PE", "18x", "1.8 万亿", "47%"],
          ["广告", "EV/EBITDA", "15x", "0.7 万亿", "18%"],
          ["金融科技", "PE", "12x", "0.9 万亿", "24%"],
          ["投资业务", "市值折价", "0.8x", "0.4 万亿", "11%"]
        ]
      },
      "insight": "综合分部估值，腾讯合理市值约 3.8 万亿港元，对应每股 HK$450，较当前股价有 14% 上行空间。当前 Forward PE 15.8x 处于历史低位，风险收益比吸引。"
    },
    "risks_and_catalysts": {
      "risks": [
        {
          "title": "监管政策不确定性",
          "description": "反垄断、数据安全、未成年人保护等政策仍可能出台新措施，影响游戏和广告收入。",
          "severity": "medium"
        },
        {
          "title": "游戏行业竞争加剧",
          "description": "米哈游、字节跳动等竞争对手持续推出爆款产品，可能侵蚀腾讯市场份额。",
          "severity": "medium"
        },
        {
          "title": "宏观经济疲软",
          "description": "广告和支付业务高度依赖宏观经济，若消费复苏不及预期将直接影响业绩。",
          "severity": "high"
        }
      ],
      "catalysts": [
        {
          "title": "DNF 手游上线",
          "description": "《地下城与勇士》手游定档 2025Q2，市场预期首年流水可达 50-80 亿元。",
          "timeline": "2025 Q2"
        },
        {
          "title": "视频号电商闭环",
          "description": "微信小店和视频号直播电商GMV 目标翻倍，广告和佣金收入有望超预期。",
          "timeline": "2025 全年"
        },
        {
          "title": "AI Agent 产品发布",
          "description": "混元大模型驱动的 C 端和 B 端 AI 产品陆续落地，可能成为新的增长引擎。",
          "timeline": "2025 H2"
        }
      ]
    }
  }
}
